{
  "id": "steam",
  "recipeVersion": "0.1.0",
  "catalog": {
    "name": "Steam",
    "shortDescription": "Primary PC game launcher and storefront.",
    "category": "Gaming",
    "homepage": "https://store.steampowered.com/about/",
    "isPortable": false
  },
  "preferredProvider": "Winget",
  "source": {
    "type": "Winget",
    "identifier": "Valve.Steam",
    "officialUrl": "https://store.steampowered.com/about/"
  },
  "trustLevel": "Experimental",
  "scopePreference": "Preferred",
  "administratorRequirement": "Required",
  "portableDestinationHint": null,
  "dependencies": [],
  "conflicts": [],
  "expectedExitCodes": [
    0
  ],
  "rebootBehavior": "NeverAutomatic",
  "detection": {
    "rules": [
      "wingetPackage:Valve.Steam",
      "uninstallRegistryDisplayName:Steam"
    ],
    "minimumConfidence": "High"
  },
  "update": {
    "method": "Winget",
    "supported": true
  },
  "uninstall": {
    "method": "Winget",
    "supported": true
  },
  "verification": {
    "verifiedOn": "2026-06-26",
    "evidence": "Read-only Phase 1 catalog entry. Install, update, and uninstall execution are intentionally not implemented yet."
  }
}

