{
  "id": "firefox",
  "recipeVersion": "0.1.0",
  "catalog": {
    "name": "Mozilla Firefox",
    "shortDescription": "Independent web browser with strong extension support.",
    "category": "Browsers",
    "homepage": "https://www.mozilla.org/firefox/",
    "isPortable": false
  },
  "preferredProvider": "Winget",
  "source": {
    "type": "Winget",
    "identifier": "Mozilla.Firefox",
    "officialUrl": "https://www.mozilla.org/firefox/"
  },
  "trustLevel": "Experimental",
  "scopePreference": "Preferred",
  "administratorRequirement": "Required",
  "portableDestinationHint": null,
  "dependencies": [],
  "conflicts": [],
  "expectedExitCodes": [
    0
  ],
  "rebootBehavior": "NeverAutomatic",
  "detection": {
    "rules": [
      "wingetPackage:Mozilla.Firefox",
      "uninstallRegistryDisplayName:Mozilla Firefox"
    ],
    "minimumConfidence": "High"
  },
  "update": {
    "method": "Winget",
    "supported": true
  },
  "uninstall": {
    "method": "Winget",
    "supported": true
  },
  "verification": {
    "verifiedOn": "2026-06-26",
    "evidence": "Read-only Phase 1 catalog entry. Install, update, and uninstall execution are intentionally not implemented yet."
  }
}

