{
  "id": "7zip",
  "recipeVersion": "0.1.0",
  "catalog": {
    "name": "7-Zip",
    "shortDescription": "Reliable file archiver for common compressed formats.",
    "category": "Utilities",
    "homepage": "https://www.7-zip.org/",
    "isPortable": false
  },
  "preferredProvider": "Winget",
  "source": {
    "type": "Winget",
    "identifier": "7zip.7zip",
    "officialUrl": "https://www.7-zip.org/"
  },
  "trustLevel": "Experimental",
  "scopePreference": "Preferred",
  "administratorRequirement": "Required",
  "portableDestinationHint": null,
  "dependencies": [],
  "conflicts": [],
  "expectedExitCodes": [
    0
  ],
  "rebootBehavior": "NeverAutomatic",
  "detection": {
    "rules": [
      "wingetPackage:7zip.7zip",
      "uninstallRegistryDisplayName:7-Zip",
      "filePath:%ProgramFiles%\\7-Zip\\7zFM.exe"
    ],
    "minimumConfidence": "High"
  },
  "update": {
    "method": "Winget",
    "supported": true
  },
  "uninstall": {
    "method": "Winget",
    "supported": true
  },
  "verification": {
    "verifiedOn": "2026-06-26",
    "evidence": "Read-only Phase 1 catalog entry. Install, update, and uninstall execution are intentionally not implemented yet."
  }
}
